{
  "schemaVersion": "gcac.action/v1",
  "actionType": "certificate.deploy",
  "actionSchemaVersion": "1.0",
  "requestId": "action_fixture_1",
  "idempotencyKey": "certificate.deploy:iis_site_1:version_1",
  "agentProduct": {
    "productLine": "windows-modern",
    "productVersion": "1.0.0",
    "runtimeName": "go",
    "runtimeVersion": "1.23.0"
  },
  "capabilitySnapshotRef": {
    "snapshotId": "snapshot_fixture_1",
    "snapshotVersion": "1",
    "capturedAt": "2026-07-21T00:00:00.000Z"
  },
  "target": {
    "targetType": "service_instance",
    "targetId": "iis_site_1"
  },
  "input": {
    "certificateVersionId": "version_1"
  },
  "requiredCapabilities": [],
  "dryRun": false,
  "audit": {
    "tenantId": "default",
    "requestId": "req_fixture_1",
    "correlationId": "corr_fixture_1",
    "executionRunId": "run_fixture_1",
    "executionStepId": "step_fixture_1"
  }
}
